{
	"$schema": "./schema.json",
	"id": "depot",
	"name": "Depot",
	"description": "Build acceleration platform providing compute, caching, and observability for GitHub Actions, Docker, and many popular build tools",
	"logoType": "depot",
	"categories": [
		{
			"name": "Official Accounts",
			"contacts": [
				{
					"product": "Official Account",
					"handles": ["@depotdev"],
					"email": "help@depot.dev"
				}
			]
		},
		{
			"name": "Leadership",
			"contacts": [
				{
					"product": "CEO",
					"handles": ["@kylegalbraith"],
					"email": "kyle@depot.dev"
				},
				{
					"product": "CTO",
					"handles": ["@jacobwgillespie"],
					"email": "jacob@depot.dev"
				}
			]
		}
	]
}
