{
  "$schema": "./schema.json",
  "id": "google-ai-studio",
  "name": "Google AI Studio",
  "description": "Google AI Studio is a platform for building and deploying AI models",
  "logoType": "google-ai-studio",
  "categories": [
    {
      "name": "Official Accounts",
      "contacts": [
        {
          "product": "Official Google AI Studio Account",
          "handles": ["@GoogleAIStudio"]
        }
      ]
    },
    {
      "name": "Product",
      "contacts": [
        {
          "product": "AI Studio & Gemini API",
          "handles": ["@OfficialLoganK"]
        },
        {
          "product": "AI Developer Experience",
          "handles": ["@_philschmid"]
        }
      ]
    }
  ]
}
