{
  "$schema": "@/data/companies/schema.json",
  "id": "github",
  "name": "GitHub",
  "description": "Platform for version control and collaboration",
  "logoType": "github",
  "categories": [
    {
      "name": "Official Accounts",
      "contacts": [
        { "product": "Official GitHub Account", "handles": ["@github"] }
      ]
    },
    {
      "name" : "GitHub Team",
      "contacts" : [
        { "product" : "Platform", "handles": ["@jaredpalmer"]}
      ]
    }
  ]
}

